<?xml version="1.0" encoding="UTF-8"?>
<xs:schema xmlns:xs="http://www.w3.org/2001/XMLSchema">
    <xs:element name="students">
        <xs:complexType>
            <xs:sequence>
                <xs:element name="student" maxOccurs="unbounded">
                    <xs:complexType>
                        <xs:sequence>
                            <xs:element name="studentId" type="xs:positiveInteger"/>
                            <xs:element name="studentFirstName" type="xs:string"/>
                            <xs:element name="studentLastName" type="xs:string"/>
                            <xs:element name="studentUniversityId" type="xs:positiveInteger"/>
                        </xs:sequence>
                    </xs:complexType>
                </xs:element>
            </xs:sequence>
        </xs:complexType>
    </xs:element>

</xs:schema>